[
  {
    "id": "pickpocket",
    "name": "小偷",
    "line": "thief",
    "tier": 1,
    "cost": { "gold": 250000, "wood": 0 },
    "attack": 8000,
    "attackInterval": 1000,
    "range": 2000,
    "attackType": "normal",
    "stealBase": 4000,
    "critRate": 50,
    "critMul": 1500,
    "block": 0,
    "slowWhileBlocked": 0,
    "upgradesTo": ["cutpurse"],
    "sellsFor": 700,
    "icon": "ui/icon_pickpocket",
    "sprite": "towers/pickpocket",
    "description": "神偷系起点，250 金即可窃金。放在★停顿点，3 分钟内看到第一笔钱。",
    "roleTag": "core"
  },
  {
    "id": "cutpurse",
    "name": "扒手",
    "line": "thief",
    "tier": 2,
    "cost": { "gold": 800000, "wood": 0 },
    "attack": 20000,
    "attackInterval": 909,
    "range": 2000,
    "attackType": "normal",
    "stealBase": 8000,
    "critRate": 50,
    "critMul": 1500,
    "block": 0,
    "slowWhileBlocked": 0,
    "upgradesTo": ["master_thief"],
    "sellsFor": 700,
    "icon": "ui/icon_cutpurse",
    "sprite": "towers/cutpurse",
    "description": "窃金系数翻倍。攻击力同时是窃金乘区，升级永远比铺塔更赚。",
    "roleTag": "core"
  },
  {
    "id": "master_thief",
    "name": "神偷",
    "line": "thief",
    "tier": 3,
    "cost": { "gold": 2500000, "wood": 0 },
    "attack": 45000,
    "attackInterval": 833,
    "range": 2200,
    "attackType": "pierce",
    "stealBase": 14000,
    "critRate": 50,
    "critMul": 1500,
    "block": 0,
    "slowWhileBlocked": 0,
    "upgradesTo": ["grandmaster"],
    "sellsFor": 700,
    "icon": "ui/icon_master_thief",
    "sprite": "towers/master_thief",
    "description": "潜行：窃金效率 +25%。核心经济塔的标准形态。",
    "roleTag": "core",
    "abilities": [{ "id": "stealth", "cooldown": 0, "params": { "stealPct": 250 } }]
  },
  {
    "id": "grandmaster",
    "name": "宗师",
    "line": "thief",
    "tier": 4,
    "cost": { "gold": 8000000, "wood": 0 },
    "attack": 110000,
    "attackInterval": 769,
    "range": 2400,
    "attackType": "pierce",
    "stealBase": 26000,
    "critRate": 50,
    "critMul": 1500,
    "block": 0,
    "slowWhileBlocked": 0,
    "upgradesTo": ["goldfinger"],
    "sellsFor": 700,
    "icon": "ui/icon_grandmaster",
    "sprite": "towers/grandmaster",
    "description": "点金术：每 20s 秒杀血量 <15% 的敌人并全额夺取其剩余钱包。",
    "roleTag": "core",
    "abilities": [
      { "id": "stealth", "cooldown": 0, "params": { "stealPct": 250 } },
      {
        "id": "midas_touch",
        "cooldown": 20000,
        "params": { "hpThresholdPct": 150, "fullWalletSteal": 1 }
      }
    ]
  },
  {
    "id": "goldfinger",
    "name": "飞贼·金手指",
    "line": "thief",
    "tier": 5,
    "cost": { "gold": 25000000, "wood": 0 },
    "attack": 280000,
    "attackInterval": 667,
    "range": 3000,
    "attackType": "chaos",
    "stealBase": 55000,
    "critRate": 50,
    "critMul": 1500,
    "block": 0,
    "slowWhileBlocked": 0,
    "sellsFor": 700,
    "icon": "ui/icon_goldfinger",
    "sprite": "towers/goldfinger",
    "description": "瞬移：可免费重新部署；窃金无视护甲克制。唯一能全额伤害神圣甲的塔。",
    "roleTag": "endgame",
    "abilities": [
      { "id": "stealth", "cooldown": 0, "params": { "stealPct": 250 } },
      { "id": "relocate_free", "cooldown": 0, "params": { "goldCost": 0 } },
      { "id": "steal_ignore_counter", "cooldown": 0, "params": { "ignoreCounter": 1 } }
    ]
  },

  {
    "id": "archer",
    "name": "弓手",
    "line": "archer",
    "tier": 1,
    "cost": { "gold": 200000, "wood": 0 },
    "attack": 14000,
    "attackInterval": 1111,
    "range": 5500,
    "attackType": "pierce",
    "stealBase": 0,
    "critRate": 0,
    "critMul": 1000,
    "block": 0,
    "slowWhileBlocked": 0,
    "upgradesTo": ["multi_archer"],
    "sellsFor": 700,
    "icon": "ui/icon_archer",
    "sprite": "towers/archer",
    "description": "廉价远程，前期守线主力。后期请及时转向其它塔系。",
    "roleTag": "transition"
  },
  {
    "id": "multi_archer",
    "name": "多重弓手",
    "line": "archer",
    "tier": 2,
    "cost": { "gold": 600000, "wood": 0 },
    "attack": 26000,
    "attackInterval": 1000,
    "range": 6000,
    "attackType": "pierce",
    "stealBase": 0,
    "critRate": 0,
    "critMul": 1000,
    "block": 0,
    "slowWhileBlocked": 0,
    "upgradesTo": ["archer_mom"],
    "sellsFor": 700,
    "icon": "ui/icon_multi_archer",
    "sprite": "towers/multi_archer",
    "description": "多重箭 ×2 目标：同时命中多个敌人，是应对空中群的关键。",
    "roleTag": "transition",
    "abilities": [{ "id": "multishot", "cooldown": 0, "params": { "targets": 2 } }]
  },
  {
    "id": "archer_mom",
    "name": "弓手老妈",
    "line": "archer",
    "tier": 3,
    "cost": { "gold": 1800000, "wood": 0 },
    "attack": 50000,
    "attackInterval": 909,
    "range": 6500,
    "attackType": "pierce",
    "stealBase": 0,
    "critRate": 0,
    "critMul": 1000,
    "block": 0,
    "slowWhileBlocked": 0,
    "upgradesTo": ["principal_mom"],
    "sellsFor": 700,
    "icon": "ui/icon_archer_mom",
    "sprite": "towers/archer_mom",
    "description": "多重箭 ×3 目标。射程优势可以覆盖两条路径的交汇段。",
    "roleTag": "transition",
    "abilities": [{ "id": "multishot", "cooldown": 0, "params": { "targets": 3 } }]
  },
  {
    "id": "principal_mom",
    "name": "校长老妈",
    "line": "archer",
    "tier": 4,
    "cost": { "gold": 5000000, "wood": 0 },
    "attack": 95000,
    "attackInterval": 833,
    "range": 7000,
    "attackType": "pierce",
    "stealBase": 0,
    "critRate": 0,
    "critMul": 1000,
    "block": 0,
    "slowWhileBlocked": 0,
    "sellsFor": 700,
    "icon": "ui/icon_principal_mom",
    "sprite": "towers/principal_mom",
    "description": "多重箭 ×4 目标 + 弹射 1 次。弓箭系终点（明确的设计意图：过渡塔）。",
    "roleTag": "transition",
    "abilities": [
      { "id": "multishot", "cooldown": 0, "params": { "targets": 4 } },
      { "id": "bounce", "cooldown": 0, "params": { "bounces": 1 } }
    ]
  },

  {
    "id": "mage",
    "name": "法师",
    "line": "mage",
    "tier": 1,
    "cost": { "gold": 300000, "wood": 0 },
    "attack": 12000,
    "attackInterval": 1250,
    "range": 4500,
    "attackType": "magic",
    "stealBase": 0,
    "critRate": 0,
    "critMul": 1000,
    "block": 0,
    "slowWhileBlocked": 0,
    "upgradesTo": ["shaman"],
    "sellsFor": 700,
    "icon": "ui/icon_mage",
    "sprite": "towers/mage",
    "description": "魔法攻击，对重甲 ×1.5。本级尚无光环，尽快升 T2。",
    "roleTag": "transition"
  },
  {
    "id": "shaman",
    "name": "萨满",
    "line": "mage",
    "tier": 2,
    "cost": { "gold": 900000, "wood": 0 },
    "attack": 24000,
    "attackInterval": 1111,
    "range": 5000,
    "attackType": "magic",
    "stealBase": 0,
    "critRate": 0,
    "critMul": 1000,
    "block": 0,
    "slowWhileBlocked": 0,
    "auras": [{ "kind": "attackPct", "value": 250, "radius": 4000, "affects": "allyTower" }],
    "upgradesTo": ["watcher"],
    "sellsFor": 700,
    "icon": "ui/icon_shaman",
    "sprite": "towers/shaman",
    "description": "心灵之火：半径 4 格内友方塔 +25% 攻击（同级不叠加，取最高）。",
    "roleTag": "support"
  },
  {
    "id": "watcher",
    "name": "守望者",
    "line": "mage",
    "tier": 3,
    "cost": { "gold": 2200000, "wood": 0 },
    "attack": 40000,
    "attackInterval": 1000,
    "range": 5000,
    "attackType": "magic",
    "stealBase": 0,
    "critRate": 0,
    "critMul": 1000,
    "block": 0,
    "slowWhileBlocked": 0,
    "auras": [{ "kind": "speedPct", "value": 300, "radius": 4000, "affects": "allyTower" }],
    "upgradesTo": ["mage_dad"],
    "sellsFor": 700,
    "icon": "ui/icon_watcher",
    "sprite": "towers/watcher",
    "description": "嗜血：半径 4 格内友方塔 +30% 攻速。攻速直接放大窃金频率。",
    "roleTag": "support"
  },
  {
    "id": "mage_dad",
    "name": "法师老爸",
    "line": "mage",
    "tier": 4,
    "cost": { "gold": 5500000, "wood": 0 },
    "attack": 75000,
    "attackInterval": 1000,
    "range": 5500,
    "attackType": "magic",
    "stealBase": 0,
    "critRate": 0,
    "critMul": 1000,
    "block": 0,
    "slowWhileBlocked": 0,
    "auras": [{ "kind": "slowPct", "value": 400, "radius": 5000, "affects": "enemy" }],
    "upgradesTo": ["archmage_grandpa"],
    "sellsFor": 700,
    "icon": "ui/icon_mage_dad",
    "sprite": "towers/mage_dad",
    "description": "高级减速：半径 5 格内敌人 −40% 移速。拉长窃金窗口。",
    "roleTag": "support"
  },
  {
    "id": "archmage_grandpa",
    "name": "法师爷爷",
    "line": "mage",
    "tier": 5,
    "cost": { "gold": 14000000, "wood": 0 },
    "attack": 140000,
    "attackInterval": 909,
    "range": 6000,
    "attackType": "magic",
    "stealBase": 0,
    "critRate": 0,
    "critMul": 1000,
    "block": 0,
    "slowWhileBlocked": 0,
    "auras": [
      { "kind": "allPct", "value": 150, "radius": 0, "affects": "allyTower" },
      { "kind": "rangePct", "value": 100, "radius": 0, "affects": "allyTower" }
    ],
    "sellsFor": 700,
    "icon": "ui/icon_archmage_grandpa",
    "sprite": "towers/archmage_grandpa",
    "description": "大法师光环：全图 +15% 攻击 / +15% 攻速 / +10% 射程。",
    "roleTag": "endgame",
    "abilities": [
      { "id": "archmage_range_aura", "cooldown": 0, "params": { "rangePct": 100 } }
    ]
  },

  {
    "id": "drill_instructor",
    "name": "军训教官",
    "line": "drill",
    "tier": 1,
    "cost": { "gold": 350000, "wood": 0 },
    "attack": 26000,
    "attackInterval": 1000,
    "range": 1800,
    "attackType": "normal",
    "stealBase": 0,
    "critRate": 0,
    "critMul": 1000,
    "block": 3,
    "slowWhileBlocked": 400,
    "upgradesTo": ["iron_gate", "discipline_dean"],
    "sellsFor": 700,
    "icon": "ui/icon_drill_instructor",
    "sprite": "towers/drill_instructor",
    "description": "列阵：被阻挡的敌人移速 −40%。把敌人锁在★停顿点，拉长窃金窗口。",
    "roleTag": "blocker",
    "abilities": [{ "id": "phalanx", "cooldown": 0, "params": { "slowPct": 400 } }]
  },
  {
    "id": "iron_gate",
    "name": "铁闸守卫",
    "line": "drill",
    "tier": 2,
    "cost": { "gold": 1500000, "wood": 0 },
    "attack": 55000,
    "attackInterval": 909,
    "range": 2000,
    "attackType": "normal",
    "stealBase": 0,
    "critRate": 0,
    "critMul": 1000,
    "block": 6,
    "slowWhileBlocked": 400,
    "sellsFor": 700,
    "icon": "ui/icon_iron_gate",
    "sprite": "towers/iron_gate",
    "description": "锁链：每 15s 把最接近宝库的 1 个地面敌人拉回 3 格。阻挡 6。",